"","text","subject_label","subject_predicted"
"1062","As the same leg served as both the control and the experimental, I would recommend the paired T-test rather than a two-sample t-test",3,3
"1063","This will be more obvious if you change the x-axis. In that case, you don’t need to specify which bar corresponds with each leg.",3,3
"1064","Threshold was measured in V",3,3
"1065","It would have been better to organize these values by R:S weight and R:S length than by treatment",3,3
"1066","I think this is a qualitative result of your experiment. So this information should e in the results also.",3,4
"1067","Repeating information",2,2
"1068","The manual we use is not about Cell structure.",3,2
"1069","Can you be more specific? Studied physiological process.",2,2
"1070","What are your control groups?",3,3
"1071","Not technically true. Just not significant at the alpha level we used (0.05)",3,3
"1072","Your results seem to say that caffeine inhibited contraction rather than increasing contractile strength. While it is statistically significant, this would mean that caffeine had a significant effect in eliminating contraction rather than increasing it.",3,3
"1073","()",2,3
"1074","extracted",2,3
"1075","I get what you’re saying, but the way this is worded is a little confusing.",2,2
"1076","State whether your hypothesis was supported/rejected first, and then you can go into the reasoning behind why you came up with your hypothesis",4,2
"1077","Incorporate your herbicide factor in your hypothesis.",4,2
"1078","In the figures you display trends of the data, not p-values, so you don’t need to make a reference of the figure to explain the statistical analysis",3,3
"1079","This is synonymous with “aggressive”",2,3
"1080","What we labeled the tubes isn’t important",3,3
"1081","For figure 3 &amp; 4: You should consolidate how you express the s.d.’s.  Also, include the respective t-test results with the graphs. Otherwise they are good.",3,3
"1082","Strengthen this statement.",2,2
"1083","You also tend to write really short sentences that makes your report read really choppy. Adding detail will help with this. So ask yourself “why” and “how” to help you out.",2,2
"1084","You can state your hypothesis without explicitly stating this",2,2
"1085","I don’t understand how is this study explaining your results. What is your interpretation based on what they did? If you can make the link between this study and the study of the other researchers, then it will be more clear.",4,4
"1086","conducted",2,3
"1087","You don’t want to get those results by hope",3,2
"1088","Ok, I hope I see evidence of this in your discussion!",2,2
"1089","Outside sources missing (Basic criteria)",1,1
"1090","This can be said without referring to tube labels",2,3
"1091","Main problem, you are saying what you did, like in the methods. That is not part of the discussion. Just focus on mentioning the obtained result and trying to explain that with the effect of lidocaine on Na+ channels and how this is influencing the contractionCitations are needed in this section",3,2
"1092","This is pretty obvious at this point in the intro, so either get rid of it or put it earlier in the paragraph",2,2
"1093","the crops",2,3
"1094","Add a sentence about why this research matters.",2,2
"1095","This seems a little out-of-place. Absorbance of what?",3,3
"1096","Between what treatments?",3,3
"1097","How does this relate to muscle contraction?",4,3
"1098","Fix this up, I think we talked about it",2,3
"1099","I would put a “we predict that if..” in front of this, otherwise it seems like a fact.",2,2
"1100","Did you add the AzaMax only in two animals or in the 4 experimental individuals?",3,3
"1101","You should have 2 degrees of freedom for 3 paired legs. Talk to your group mates about the tests, and come see me if you have questions.",3,3
"1102","At what temp?",3,3
"1103","All information that is not common knowledge needs to be cited.",3,3
"1104","This citation only is not enough. You need another citation, not only the lab manual.",3,3
"1105","What are the costs and benefits of this behavior?",4,4
"1106","Several of these citations are not primary peer-reviewed literature",3,3
"1107","Check your axesx-axis: there were not control frogs. The same muscle was used for both conditions, control and treatment. Write the axis in correspondence to that. Can you be more specific for the y-axis? Amplitude of contraction",3,3
"1108","Why are you talking about weight?",3,3
"1109","Your figures are at the bottom but Im going to address them here.  You should remove the table, it is summed up sufficiently in your bar graph. Each figure (graph) needs a stronger caption. What goes in these captions are explained in the Bio Res. Guide however remember to include the statistics and the standard deviation values in the figure caption of your Figure 2.  Only the stats would go in the fig 1 caption.  The figures should not have titles.",3,3
"1110","Refer to by specific figure numbers. Never reference by position in a report.",3,3
"1111","How much of this did you inject?",3,3
"1112","You need some form of prediction/hypothesis so it doesn’t sound like you just did this and recorded the results with no ideas about what would happen.",4,2
"1113","The results of the statistical analysis should be included in the results section, nt here",3,3
"1114","define that this is what you considered threshold",3,3
"1115","Methods should not be a list and you do not need to provide a list of materials. You need far more detail.",3,3
"1116","RedactionThis is written like an explanation of the result. To include it in this section, you need to write this like an observation of the experiment.",3,2
"1117","Start broad. What’s the biological concept here?",2,2
"1118","You only need this figure, you don’t necessarily need the other one. Figures should not have titles and you should not have average weigh of caterpillar as a y-axis, think about what you are actually measuring.",3,3
"1119","Remove this",2,2
"1120","We make conclusion at the end of discussion not when describing results.",2,2
"1121","Hypothesis comes before methods",2,2
"1122","Azamax is the brand, azadirachtin is the IGR in it",3,3
"1123","this is much to long – the paragraph could be substantially condensed and focusedalso, citations?",2,3
"1124","You can report the p-value again here to help back this up",3,3
"1125","This is a great find. Can you say any more about this study? For example, how did they quantify avoidance? Why did they think this was happening?",4,4
"1126","This is definitely better, I would just have the legend say “Control 1, Control 2, etc”, as it makes the graph easier to interpret",3,3
"1127","Write this up in paragraph form or make a succinct table that includes both weight and length stats.",3,3
"1128","Or, in a more positive light (ha!), lights could be utilized to optimize growth.",4,3
"1129","Include stats values here",3,3
"1130","This figure contains raw data. Only use summary data in your lab report.",3,3
"1131","What’s the typical pattern of resource allocation? How do plants respond to heterogenous scarcity?",4,4
"1132","Because you talk about twitch threshold, there should be a figure or table that displays them for each leg before and after treatment",3,3
"1133","Provide numbers to emphasize how big the difference is",3,3
"1134","Simplified, K+ channels open after the acetylcholine is released and causes potassium to flow out and hyperpolarize the cell. This brings the nerve back down and near its resting potential. (In short, the potassium helps the nerve reset).",3,4
"1135","Just say what you are studying, it doesn’t have to be explicitly stated that you are studying this because it is understood",2,2
"1136","What statistical test did you plan on running?",3,3
"1137","You do not need a table and a graph, as they state the same information. Just include the graph.",3,3
"1138","Which t-test did you use?",3,3
"1139","Hypothesis should be in just one sentence",2,2
"1140","Include standard deviations with all your averages",3,3
"1141","You need citations in your introduction. This is a violation of the basic criteria and is an automatic failing grade. You also never explain the concept of aggression.",1,1
"1142","If you need help on how to screenshot a figure, let me know. This is very difficult to read at this scale.",3,3
"1143","Is this a p-value? (p=…)",3,3
"1144","any time you have an average graphed, you will need standard deviation bars. As such, this graph should have 14 standard deviation bars total.",3,3
"1145","In the future, this is the type of info you should focus on in the introduction section",2,2
"1146","Those error bars look much better, nice job! Quick thing though, your y-axis label should have units on it",3,3
"1147","You need to justify that this test compound as an inhibitor by backing up with primary lit",3,3
"1148","Your hypothesis is the first time you mention murky water – use your introduction to tell the reader the background on why water clarity might matter. What you have so far is quite good, but nothing here helps me understand why you are testing murky water and what you are basing your hypothesis on.",4,4
"1149","Use standard error, not standard deviation. Standard error is SD divided by the square root of sample size",3,3
"1150","These two sentence can go. Just start with talking about the frog.",2,2
"1151","Relate this back to a bigger picture. Why is it important that we understand the effect of temperature on photosynthetic rate?",4,4
"1152","List the standard devs as well",3,3
"1153","I would rather report stat values instead of avg distances",3,3
"1154","This title is not concise. There are words that do not contribute to the message of the title. How injecting lidocaine--- Is not better just say lidocaineBiologically Significant in Its Effects --- What does this means? That is not preciseToo many words. Try to make your title shorter than 20 words. If you change those meaningless phrases, your title will be shorter and more precise",2,2
"1155","State t-tstat and df as well",3,3
"1156","This should be in sentence form.",3,2
"1157","Your introduction needs primary literature from a scientific journal",1,2
"1158","Unnecessary info",2,2
"1159","What was the concentration of the caffeine solution?",3,3
"1160","You should support this with the values and the figures. Do not say, those were additional legs, just combine this with your results.",3,3
"1161","Can you provide previous studies supporting this statement? In the discussion, you should interpret your results based on previous studies.",4,4
"1162","This table is not a good choice to represent this data. A graph would be much clearer. If you are confused about how to create a graph of this data, please email me or set up a time to discuss in person.",3,3
"1163","State what these averages are (+/- a standard deviation)",3,3
"1164","SD?",3,3
"1165","I know the resource guide asks you to state dependent/independent variables, but as long as what you are treating the caterpillars with is in there, the variables are implied and you don’t have to include a sentence like this if you don’t want to, especially in the intro.",3,2
"1166","At what temp?",3,3
"1167","You can state your p-value here to back this up",3,3
"1168","Citation formatting. This is an article published in Molecular and Cellular Endocrinology. 57: 251-259. Check the BioCore Guide pages 48-49",3,3
"1169","Why did you use a mirror? How did you compare mirrored aggression to aggression towards another individual",3,3
"1170","Include the name as well.",2,3
"1171","Also, did the same people observe the fish each time to minimize bias? Explain exactly how you tallied the points.",3,3
"1172","Give some indication of the results here",2,2
"1173","Although we do want to show significant differences usually, it’s an unspoken rule that you don’t just state “We are going after significance” as that shouldn’t be the goal of science.",3,3
"1174","Good abstractInclude statistics values when talking about your results.",2,3
"1175","Should reflect highlights from discussion as well.",2,2
"1176","The specific amount isn’t as important for the introduction.",3,2
"1177","Missing statistical analysis",3,3
"1178","Not a best way to start the introduction. Start broadly.",2,2
"1179","informal",2,2
"1180","As this is the standard alpha value, you don’t need to state your alpha value unless it’s different from 0.05",3,3
"1181","Unnecessary",2,2
"1182","I would nix the equations.",2,3
"1183","Check in the annotation exercise how to report the statistics outcome in the results.",3,3
"1184","I am not sure manipulated is the right choice here. Implies that the external factors have an agenda or a goal, which they don’t.",2,2
"1185","Avoid using “correct” as there is always some uncertainties in science. Your data may always have come from a reason separate from your original hypothesis. As such, I would say “supported”",2,2
"1186","Watch your significant digits.",3,3
"1187","Hypothesis are neither correct or incorrect. The data support the hypothesis or make you reject it, but that does not mean it was correct or incorrect.",2,3
"1188","Try to note if you noticed any trends. I would also vaguely include a sentence or 2 about potassium’s role in normal neuromuscular function. Also include your original hypothesis.",2,2
"1189","Avoid this recipe style of writing methods section because that’s not how it is used in a scientific literature. Check primary literature on similar experiments to see how they wrote their methods section and revise.",2,2
"1190","Statistic is not a measurement of accuracy",3,3
"1191","Also include your t-statistic and degrees of freedom",3,3
"1192","As this is the abstract, you can be a bit vague with the citation and leave it as “in a previous study…” and leave out the in-text.",2,2
"1193","What is? (Model system question)",3,2
"1194","This should have been referenced in the methods if it was meant to go there. Remember that the figures are not part of the results section, either. They are in their own section at the end, which is why you need to always refer people to them from within the paper (in whatever section – usually results – it makes most sense to do so in).",3,3
"1195","The error bars are improperly formatted",3,3
"1196","Keep it past tense.",2,2
"1197","Problem with standard errors",3,3
"1198","Which leg?  During control or treatment?",3,3
"1199","Missing outside sources (basic criteria)",1,1
"1200","Herbicide was your another treatment",3,3
"1201","You won’t need to create a justification for your statistical test",3,3
"1202","Year goes after the Authors name",3,3
"1203","Rather than saying their study had better results, I would focus on whether they had similar results/conclusions as your study.",3,4
"1204","Supported not correct. Solid abstract, but you need a sentence or two of methods.",2,2
"1205","Probably not necessary",2,2
"1206","Screenshot just the figure not the whole screen",3,3
"1207","Remember, you need a hypothesis in your abstract",2,2
"1208","Which is how many nm?",3,3
"1209","Pick only one to use.  There are reasons to use one versus two tailed.",3,2
"1210","Include the stats results",3,3
"1211","Have you looked up other studies on this test compound to find their concentration?",3,3
"1212","I can tell you that this was not the case. All our frogs are about the same age and are killed just before lab starts.",3,3
"1213","Revise",2,2
"1214","Unnecessary",2,2
"1215","Do you think this would have affected length differently than weight? Otherwise, this is  weak argument. The shade cloth did let some light through (about 25%).",4,4
"1216","In your intro you need to talk more about the biological things that happen what would be affected by caffeine",4,4
"1217","These are results. This is a serious organization issue and an automatic failing grade",1,2
"1218","Did you run the ANOVA on this as well? Need p-value…",3,3
"1219","Through what? (Abstract wording)",2,2
"1220","There’s a lot in this sentence, can you unpack it a bit, and explain what R:S ratio is?",2,2
"1221","Azamax is the brand, azadirachtin is the IGR",3,3
"1222","Did you follow up with a Tukey-Kramer? What were the results of that? How did the saline concentrations compare statistically?",3,3
"1223","You can say it rejects the null hypothesis, but the way you have it phrased here is a little odd",2,2
"1224","Need to have the scientific name in the title, which you had in your first submission.",2,2
"1225","Shorten this to say that” the weight was measured in grams”",2,3
"1226","I would leave this as “Martin’s IGR” as you explain the dilution later on in the methods",3,2
"1227","So how does this relate to your own study, what did they do similarly or how does this expand your knowledge of the topic?",4,4
"1228","You should include that was obtained at different voltages of stimulation.",3,3
"1229","Save this for the Table caption",3,3
"1230","This belongs in methods",2,2
"1231","I worded this wrong. We always want to calculate averages as a last step. So, calculate percent change for each absorbance, then average the percent changes for each group. You totally had it right, I was just confused by the wording.",3,3
"1232","infromal",2,3
"1233","Check the citation format",3,3
"1234","Do not cite your results, you didn’t take this information from a previous experiment. That was an observation from your own experiment.",3,3
"1235","Pretend you’re a scientist conducting a study; you wouldn’t refer to your NSF funded study as a lab. This is all meant to be practice to write real science.",2,2
"1236","Again, give more of a biological basis for why you’d see this affect with alkaline pH.",4,2
"1237","Is this for both groups?",3,3
"1238","You have improved but it is still recipe-style writing. Suggestion: You could open your section by saying that “The slurry/ground mixture of chickweed was centrifuged using (name of the machine we used to centrifuge) at XG, Xrmp, at Xdegrees for Xmins to extract/isolate the chloroplasts. Any debris was removed and the solution was centrifuged again (mention specifications). The pellet was isolated and treated with Hill reaction assay (Table# provided in the supplement) to quantify photosynthesis activity. The absorbances were recorded…”",3,1
"1239","Was this supposed to be a table? Please write these out!",3,3
"1240","You need to use more scientific language and connect your findings back to the big picture",2,4
"1241","“As shown in figure 1” Report means and standard deviations of the ratios.Report t-test results correctly (see resource guide).",3,3
"1242","The wording here doesn’t line up with your hypothesis. If kale is resistant, implying total ineffectivity of atrazine on kale, then why would you hypothesize reduction of photosynthetic activity in kale?",4,4
"1243","Don’t put chemical concentrations in your intro, leave it for your methods.",3,2
"1244","You need another sentence to introduce your hypothesis",2,2
"1245","How can I know which p-value corresponds to which compared variable?",3,3
"1246","You might reference the figures in this section. The reader can visualize the described result in the figure",3,3
"1247","This was not possible because the Achilles tendon was tied. Be careful with the cause-effect relations that you do.",2,2
"1248","The shoots are the leaves and the stems, so they are taken into account.",3,3
"1249","But why would this be? Tie this assertion to biological background.",4,4
"1250","See my comments on your figure caption, as I think this would be less confusing with one bar graph. Be sure to put averages with standard deviations when you fix the graph",3,3
"1251","These hormones also regulate the molting form one larva instar to the next one.",3,3
"1252","cite",3,3
"1253","What background info led you to this experimental question?",4,2
"1254","Remove this throughout the method – it is not necessary to tell the reader how you labeled tubes",3,2
"1255","Reorganize to put your hypothesis as the last sentence of your intro. Good primary literature, though!",2,2
"1256","You reported the means and standard deviations correctly in your original version, and now I see they have been removed here. Those should be included. You did report the results of the t-test correctly, so next time make sure you include all of the necessary information and you will have a great results section",3,3
"1257","informal",2,2
"1258","This is unnecessary information",2,2
"1259","What was the concentration of this chemical?",3,3
"1260","Control average of what? Change the redaction of this sentence. It is the average of the amplitude of contraction",3,3
"1261","These should be brackets [], not parentheses ()",3,3
"1262","Problem with error bars. They look the sameReconsider the x-axis",3,3
"1263","You never really explain your results, just your line of reasoning for your hypothesis. You also need to connect your findings back to the big picture.",4,4
"1264","What is the main message with this idea? That information is already mentioned in the previous sentence.",2,2
"1265","Which T-test did you use?",3,3
"1266","Instead of saying “the graph” write Figure 1",3,3
"1267","This figure also does not need error bars",3,3
"1268","Remember that tables are not figures, so you would say Table 1:… and Table 2:… rather than figure1 and 2.",3,3
"1269","Too much background for the abstract",2,2
"1270","Much of this could go in the results section",2,3
"1271","What do your error bars represent? Also, you don’t need error bars if you aren’t averaging values together.",3,3
"1272","You don’t need to quote primary literature",2,2
"1273","This belongs in your figure caption, not your results paragraph.",3,3
"1274","Look out for plagiarism both in your intro and in your methods. Find other resources and/or make them into your own words to avoid this happening again. Breathe! We’ll fix this.",3,2
"1275","Similarly, you hardly discuss your results in the discussion, instead explaining the reasoning for your hypothesis.",3,4
"1276","In your results section, just put your p-value and state whether it is significant or not. You discussion is where you talk about what that means for your hypothesis.",1,1
"1277","So, put this in later.",2,2
"1278","You can combine these two sentences into one by just cutting out what I’ve highlighted",2,2
"1279","Add your p-value in here somewhere",3,3
"1280","You already mentioned this information",2,2
"1281","Finally, those standard deviations for each group look to be the same, which shouldn’t be the case. Make sure you’re setting each bar to have it’s own standard deviation",3,3
"1282","You need to start much broader. What are the biological concepts in which we are interested? What is their importance? Why did we choose betta fish as our model species? Why is your treatment relevant?",2,4
"1283","This is not how you start a figure caption.",3,3
"1284","You need to introduce your experimental treatment in your introduction. Why is it relevant? What have previous studies found? Right now, your hypothesis comes out of left field.",2,4
"1285","In the future, it would be better to build your graph with just 1 series instead of 2. Then have the treatments as x axis labels instead of as a legend",3,3
"1286","This should be a colon :",3,3
"1287","This is part of the discussion, no results",2,2
"1288","This would be measured by the peak amplitude not by threshold.",3,3
"1289","See if you can rearrange this to put your hypothesis as the last sentence in the paragraph.",2,2
"1290","This is an abrupt jump. Instead, maybe you could transition by talking about how salinity affects plants or why might we care about salinity in particular.Example: “Because they are sessile organisms, plants must be able to adjust to adverse environmental conditions, such as the increases in salinity that are expected to affect coastal areas as sea levels rise due to warming temperatures (Citation).” – Don’t use that, obviously, but that’s an example of what I mean by a better transition.Otherwise your introduction is pretty good!",2,4
"1291","This is raw data",3,3
"1292","Provide %change data after 30 min and refer to figure.",3,3
"1293","Format: t-stat=_, d.f.=_, p=_ in parenthesis at the end of the sentence",3,3
"1294","Stats?",3,3
"1295","Biotic or abiotic? What are you actually trying to say here? “all were regulated in the greenhouse” sounds science-y but isn’t informative.",2,2
"1296","This needs citation",3,3
"1297","Paired T-test comparing the threshold before and after injection.",3,3
"1298","All of them or are you referring to Martin’s IGR?",3,3
"1299","See me if you need help making correct x-axis labels instead of text boxes. Don’t need a title",3,3
"1300","What was the main obtained result? You could briefly mention that here.",3,2
"1301","Your results are not significant. Not sure if this is just a typo. You can say your results are not statistically significant",3,3
"1302","This should go in supplement information. You should have rather mentioned your test compound treatment, i.e. treatment plates soaked in diluted test compound solution for ten minutes and drained.",2,3
"1303","fewer",2,3
"1304","Try to write this without the labels and tube numbers",3,3
"1305","Copy/pasting my comment on the first submission: Need some background on how bettas (or fish in general) react to foreign objects that they encounter, either in tanks or in the wild, to give some context for your experiment. This kind of comes out of nowhere.",4,4
"1306","Were your standard deviations for control and experimental similar to each other? If not, your error bars may have been improperly formatted",3,3
