"","text","subject_label","subject_predicted"
"1602","Yes, but here you want to really emphasize the specific effects it should have on growth because that’s what you’re basing your hypothesis on.",1,1
"1603","That’s not what statistically different means",2,2
"1604","Remove web links",2,2
"1605","3 minutes",2,2
"1606","Which data, specifically? Did you only score one fish each time, or both? Did you run the ANOVA on single fish point totals or the interaction totals? Did you run (or plan to run) any post-hoc tests?",2,2
"1607","Your introduction needs to have primary literature citations",1,1
"1608","This intro would benefit from a bit more info on the M. sexta and why you are using it as your model organism.",1,1
"1609","We make conclusion at the end of discussion not when describing results.",1,1
"1610","This sentence is a little confusing because there’s no exact chemicals or things listed. A little vague so either shorten it up or try to get specific",1,1
"1611","Delete (Remove unneeded table)",2,2
"1612","Na_ channels",1,2
"1613","Paired t-test",2,2
"1614","This should be in the discussion as it is an interpretation (Basic criteria)",1,1
"1615","Muscle contractions?",1,2
"1616","How does this happen? You should mention the role of AchE in the synapse to understand your hypothesis",1,1
"1617","shaded",2,2
"1618","Include the p-value used for statistical significance at the end of the sentence between parenthesis.",2,2
"1619","You didn’t use a myogram. The contraction was represented as a myogram.",2,2
"1620","Cite",2,2
"1621","Citation formatting",2,2
"1622","These should be +/- your standard deviations and I believe they were in Volts?",2,2
"1623","Mention here that the commitment pulse signals that it is ready to pupate and go to the next life cycle stage",1,2
"1624","What did you measure? How many replicates? What type of t-test, specifically?",2,2
"1625","Too long. I think you can omit the last part of the Title. Try to keep your titles below 20 words.",1,1
"1626","For the same reason as why we avoid “correct,” “prove” should also be avoided.",1,1
"1627","“Prepare PDA plates by strictly adhering to preparation protocol” would be a better way to put it",2,2
"1628","Your methods need to explain your analysis methods and your results need to include statistics.",2,2
"1629","Report results of your t-test as shown in the resource guideReport the means and standard deviations of the ratios.",2,2
"1630","Alpha level?",2,2
"1631","This should come before the t-test then.",2,2
"1632","You need to tie your results back to the big picture",1,1
"1633","this is much to long – the paragraph could be substantially condensed and focusedalso, citations?",1,1
"1634","Start with this inference. No need to re-state all the results in the discussion section",1,1
"1635","Your hypothesis (null or not) should not be referenced in the results! We covered this repeatedly in class and in the resource guide. This should technically cause this report to fail.",1,1
"1636","The ozone-sunlight-plant allocation connection is an interesting idea, can you develop it a little more? What is the connection between chloroplasts and stems as opposed to chloroplasts and roots?",1,1
"1637","Nothing in your introduction so far sets up this hypothesis. You should look for sources on fish behavior toward model fish/inanimate objects (I know they exist!) to introduce your particular experiment, as it is, this comes out of left field.",1,1
"1638","IGRs are a classification of chemicals, you have to be specific about which one you are using",2,2
"1639","This is an interpretation (Basic criteria)",1,1
"1640","I think pep is informal",1,1
"1641","You can leave this out",1,2
"1642","Avoid this recipe style of writing methods section because that’s not how it is used in a scientific literature. Check primary literature on similar experiments to see how they wrote their methods section and revise.",1,1
"1643","Many typos",1,1
"1644","I think this intro could have benefited from a citation of previous work involving restricted wavelength, but this was a very solid introduction overall",1,1
"1645","Language",1,1
"1646","Not necessary",1,2
"1647","Condense to the points that are most relevant",1,1
"1648","+/-",2,2
"1649","4 degrees",2,2
"1650","It does not mimic ecdysterone, just JH. Different IGRs can mimic ecdysterone, but Martin’s IGR only mimics JH",2,2
"1651","Citation formatting",2,2
"1652","This along with 4 is just raw data (basic criteria). Collect the values and present it as a graph.",2,2
"1653","This needs citation",2,2
"1654","At 27C",2,2
"1655","You Abstract should have indicated highlights of future implications of your current experiment at a broader scale.",1,1
"1656","I would probably say this was likely due to the high variability in your experimental measurements (note the huge error bar for treatment when compared to the one for control). This would be alleviated with a larger sample size as you mentioned.",2,2
"1657","Mention that this is the calcium channel blocker",2,1
"1658","This is methods so you don’t need it in figure caption, consult the core resource guide and primary literature to see how their figure captions look.",2,2
"1659","Early on in your discussion, you should state whether or not your hypothesis was supported.",1,1
"1660","Follow the formatting instructions in the citation formatting section (page 51) to construct your citation lists and in-text citations.",2,2
"1661","generate",1,2
"1662","The readers of a scientific paper read the abstract for two purposes: to decide whether they want to (acquire and) read the full paper, and to prepare themselves for the details presented in that paper. An effective abstract helps readers achieve these two purposes.",1,1
"1663","I don’t think your tables are necessary because your graph states basically the same info and you talk about the number of caterpillars that molted in the results section. I would just include the graph",2,2
"1664","Change this figure caption based on my comments for the first figure caption.",2,2
"1665","Figure legends should be self-explanatory",2,2
"1666","This goes in results.",1,2
"1667","No need to say this. But do include p-values, general trends you might’ve seen, averages/percent changes.",2,2
"1668","This sounds like location was your independent variable, not substrate",2,2
"1669","What were the shelters like? What values exactly did you run the t-test on? You didn’t run the test to determine the relationship between the groups, it was for a much more specific purpose.",2,2
"1670","Include on reference list",2,2
"1671","Pay attention to that word limit!",1,1
"1672","You used the minimum voltage required to generate the maximum contraction.",2,2
"1673","plates",2,2
"1674","Statistical results should be included in this section.",2,2
"1675","These are results, so they should go in that section, not this one",1,2
"1676","Non-significant. That is not the same than insignificant",1,2
"1677","Is that the extent of your statistical analysis? What about a Tukey-Kramer?",2,2
"1678","This section should be much more concise. Instead of giving the anecdotes of each fish, just summarize the overall trends.",2,1
"1679","This is the only time you stated that,  this needs to be elsewhere in your paper too",1,1
"1680","Try to reorganize this. Maybe give me the biology first, introduce the idea of adding salt along with primary literature, then tell me what DCPIP is and why you’re using it. The sentence about DCPIP that’s in there seems misplaced.",1,1
"1681","What is TH?",2,2
"1682","Don’t write the whole title you don’t need it, the next sentence is enough",1,1
"1683","Do not use this word without statistics",1,2
"1684","Produced by … you can actually specify the gland",2,2
"1685","Did you reference this anywhere in the lab report?",1,2
"1686","Support this with values Mean ± SD and the figure.",2,2
"1687","Write this as if you performed the whole experiment",2,1
"1688","Same problem with error bars",2,2
"1689","It would be better to justify this statement with % change data.",2,2
"1690","This is redundant",1,1
"1691","Try opening this up with a broad statement about plant resource allocation and then a summary sentence at the end about what it all means.",1,1
"1692","This should be included in sentence form in your results.",1,2
"1693","And with the way you worded your new hypothesis, this doesn’t support it, because you only mentioned lack of increase, not decrease in photosynthetic activity.",1,1
"1694","Paired t-test",2,2
"1695","You can actually combine these sentences and present it in a better way.",1,1
"1696","I would say the name of the blocker as leaving it as “ion channel blockers” misleads the reader into thinking your group tested various ion channel blockers.",2,2
"1697","This has no support.",2,2
"1698","So we centrifuged the same sample twice?",2,2
"1699","Incorrect, if the p-value&gt; 0.05, that means there is not statistical significance.",2,2
"1700","Again, what kind of growth? Roots? Shoots?",2,1
"1701","Alpha level",2,2
"1702","Which graph? Reference your figures.",2,2
"1703","This was established in the methods and doesn’t need to be stated here.",2,1
"1704","You should not have a graph title, you have no y-axis units, and your standard deviation is off. You should be showing overall change in weight not weight change every day.",2,2
"1705","This is interpretation and should go in your discussion, not in your results. Since this is the only major error in this report, I am giving you a “needs major improvements” and a warning instead of failing this report, so that you can revise it for full credit. If you are confused by what does and does not count as interpretation, please come see me or email me.",1,1
"1706","The report is incredibly thorough. You could make this section more concise by just showing the figures, and not re-stating the data in the text here",2,2
"1707","Can you summarize this a little? This is the Abstract so you don’t need too many details of the methods.",1,1
"1708","Sample size?",2,2
"1709","Start your intro with the big picture. What biological concepts are you exploring? Your study system is a means to an end, not the big picture.",1,1
"1710","any time you have an average graphed, you will need standard deviation bars. As such, this graph should have 14 standard deviation bars total.",2,2
"1711","Format for in-text citation.Ex: … was conducted by Nijhout and Williams [1974].",2,2
"1712","alpha value",2,2
"1713","How much did you inject?",2,2
"1714","This is not primary peer-reviewed literature",2,1
"1715","Why? Shouldn’t they allocate resources towards limiting reactants if there is an excess of P?",1,1
"1716","Same legs were used for control and experimental conditions.",2,2
"1717","What alpha did you set?",2,2
"1718","This should be included in the results.",2,2
"1719","Leave exact amounts for the methods. No need to include it here.",1,2
"1720","This is not the most scientific statement, so I wouldn’t include it",2,1
"1721","Azagard",2,2
"1722","It would help your reader to understand if you include the actual means and SDs of your calculated average R:S for each treatment",2,2
"1723","Somewhere in here, you need to explain that you stimulated the legs with electricity to produce a muscle twitch.",2,2
"1724","I would try to include the number of pulses and the width used to stimulate.",2,2
"1725","Ah, but it is a single cell! (Isn’t Physarum cool?!)",2,2
"1726","From each pot",1,2
"1727","This can go in results.",1,2
"1728","This is attributing all your results to error – don’t do this",1,2
"1729","Don’t use possible errors in your experiment as a reason for why your results did not support your hypothesis – what was going on inside the caterpillar?",1,1
"1730","You should say that the “null could not be rejected” due to our data not including pupation (because you didn’t have enough time to do that).  You should also include your statistics here.",2,2
"1731","Mention their names",1,2
"1732","Maybe I got the wrong version, but this should be the chart we worked on, not this table.",2,2
"1733","how would this alter your results?",1,2
"1734","I would just try to fit in a sentence talking about the role of calcium in muscle contraction",1,1
"1735","Revise",1,1
"1736","Where are all the rest of your sources? Where is your figure?",2,2
"1737","Try to avoid in-text citations within the abstract.",1,1
"1738","It wasn’t proven, but supported, and not by the graphs, by the results.",2,2
"1739","Where were they relative to each other?",2,2
"1740","Your citations need to be in a different format.",2,2
"1741","You should not present raw data in your tables",2,2
"1742","Similar to the methods, I would probably just point out there was an increase rather than the exact amount it increased by.",2,1
"1743","Nah, those were kept constant.",2,2
"1744","If you know that this probably didn’t affect the results, then don’t mention it.",1,1
"1745","Fit your error bars to your individual data points. This also needs a legend!",2,2
"1746","Also, no citations needed for your own hypothesis.",2,2
"1747","What chemical?",2,2
"1748","You only need to state the alternative hypothesis.  This is accomplished in the sentence that follows this comment.",1,1
"1749","Reconsider the hypothesis. Did you think that the caffeine caused the muscle contractions? Then, why did the muscle contract without caffeine?",1,1
"1750","State the results of the test",2,2
"1751","No need to discuss anecdotes of individual fish. Just discuss the overall trends",2,2
"1752","This is not the right test.",2,2
"1753","Why did you use a paired t-test? Please let me know if you have questions about this, because I don’t think this is the appropriate test for your data.",2,2
"1754","Provide the specific means and SDs",2,2
"1755","You don’t actually need this line or revise to make formal",1,1
"1756","Because the same subject served as your control and experimental, you should use the paired t-test",2,2
"1757","You placed oak flakes at equidistant which should have been noted here.",2,2
"1758","Be more specific (Discussion opening)",1,1
"1759","No need to discuss sources of error unless you have evidence that they actually affected the outcome",1,1
"1760","Reference your graphs in this section",2,2
"1761","This interpretation belongs in the discussion section",1,1
"1762","This would go in your discussion.  In the results, you would just state what you observed without proving reasoning.",1,1
"1763","I’m not sure this fits here, because you’re not telling me how this affected your overall results.",1,1
"1764","Not a best way to start the introduction. Start broadly.",1,1
"1765","This is a lot of information and would be difficult to write in paragraph form.  So, leave this table, but make sure the significant digits are appropriate.",2,2
"1766","Just say no significant difference between treatments (t = , df = , p =)",2,2
"1767","Clearly state your research goal",1,1
"1768","This should be year published",2,2
"1769","2",1,2
"1770","You need a bit more explanation as to why you predict this. Saying potassium “regulates” contraction is not enough to explain this specific prediction.",1,1
"1771","One sentence is needed to put your findings in a biological context",1,1
"1772","1.12 +/- 0.14",2,2
"1773","Make this a little more descriptive",1,1
"1774","You don’t need to cite for statistical tests. Make sure you include the alpha value",2,2
"1775","2% water agar plate",2,2
"1776","Just cite your figures at the end of the sentence e.g. (figure 1, figure 2).",2,2
"1777","There were no pathogens used in this study.",2,2
"1778","Why? (Color!)",2,2
"1779","Abstract should have included highlights about future implications of your current experiments at a broader scale.",1,1
"1780","What do you mean by random error?",2,2
"1781","This should be in sentence form.",2,1
"1782","?",1,2
"1783","Not found on your reference list",2,2
"1784","You need to use citations to support your claims. Otherwise, this is just hand waving. Research sensory stimuli for betta aggression.",2,1
"1785","You don’t need to get this specific, make sure they can do the experiment but they don’t have to do everything exactly as you did.",2,1
"1786","Calcium enzymes? Or, proteins affected by calcium?",1,1
"1787","Use brackets instead of parenthesis",2,2
"1788","Also raw data.",2,2
"1789","Not supported",2,1
"1790","They were in the Incubator – which keeps the caterpillars warm, so it does the opposite of a refrigerator!",2,2
"1791","Maybe try a different data analysis. Calculate the change in length from day 1 -8 and run a t-test on those values",2,2
"1792","What do you think was the cause for you not getting these results?  Also, explain why you should get those ideal results.",1,1
"1793","Try to trim this down and make sure you state the organism used or the specific muscle",1,1
"1794","0.1mL",2,2
"1795","Why? What about sand promotes root vegetable growth?",1,2
"1796","Adapt really isn’t the right word here; it refers to a specific evolutionary process as opposed to the plasticity of a trait",2,1
"1797","Needs citation",2,2
"1798","Since the stats weren’t significant, you should just conclude that there was no difference between the 2 groups",2,2
"1799","Nice using primary literature but make sure it is obvious what the connection between it and your experiment is",1,1
"1800","You can incorporate the statistical outcome at the end of the sentence describing the averaged mass for each group. Statistics will determine if those difference were by chance or not. It is unnecessary to write a whole sentence just for the statistical outcome. Check in the annotation exercise how to report statistics in the results.",2,2
"1801","Did you mean for one of these graphs to show controls?",2,2
"1802","This is all raw data. There is nothing wrong with recording their coloration and presenting that, but listing all of this information when you only reference one part of it renders it raw data which only belongs in your notebook.",2,2
"1803","Can you elaborate more the figure legend? Remember that the captions should be self-explanatory. What is the treatment? Is this the total change in mass after eight days of treatment?",2,2
"1804","You can include the outcome from statistical analysis with the corresponding result. Avoid using separate sentences just for the statistical analysis.",2,2
"1805","Check the citation format",2,2
"1806","You state this as a fact, but I think it’s your hypothesis. What background information can you find to introduce/contextualize your experiment? You need to talk about the possible effects of adding shelter before you present your hypothesis. There is some literature out there on coral reef fish using corals as hiding places from other fish, for example, and I’m sure you can think of other ways to find this information.",1,1
"1807","Your results should refer readers to your figures",2,2
"1808","What was your treatment food? What was the dilution?",2,2
"1809","don’t abbreviate",1,2
"1810","Great intro, but is a little long.  Try to look it over and see what the most important things are and don’t worry about the rest so much.",1,1
"1811","Clean up this abstract to reflect your experiment which was on growth",1,1
"1812","Good point, but you need to back it up with scientific literature.",1,1
"1813","All the other background info here is true, but you need to have some more background info about salt specifically. How might it change resource allocation?",1,1
"1814","Precision of the results? What is the interpretation pf the p-value? Do not write separate sentences just for the statistic outcome",2,2
"1815","What is this number? Did you mean 8.350 ± 0.435 g?",2,2
"1816","How much of this did you use?",2,2
"1817","Same here, just state T2 and T3 did not follow the predicted trend",2,2
"1818","Title should VERY briefly state the main takeaway of your experiment",1,1
"1819","Try to find a primary resource that gives you the same information.",2,1
"1820","No need to include a separate statistics table. This information can be found in the figure captions and in the results.",2,2
"1821","Think of other biological explanations. Maybe size doesn’t matter for aggression?",1,1
"1822","revise",1,1
"1823","(I think this flows better here.)",1,1
"1824","IMPORTANT: You should have seen growth both in your control and treatment, but should expect growth in treatment significantly higher.",2,2
"1825","However, one-way ANOVA did not show any statistically significant difference..",2,2
"1826","You do not need a table and a graph, as they state the same information. Just include the graph.",2,2
"1827","Delete gridlinesInclude axes titles",2,2
"1828","What are the bars? Error bars? Numbers?",2,2
"1829","Avoid this recipe style of writing methods section because that’s not how it is used in a scientific literature. Check primary literature on similar experiments to see how they wrote their methods section and revise.",1,1
"1830","Once again you need primary literature",1,1
"1831","Remember, adaptation and plasticity are two different concepts. The ability to perform resource allocation is an adaptation, the allocation itself is an example of plasticity.",2,1
"1832","Though your p-value is insignificant, you can still state general trends in your data. Just be sure to be clear that they are not supported statistically, just an observation that can be testing for significance in the future",2,2
"1833","How is JH amount related to length? Explain why you think this",1,1
"1834","What data? The sum of both fish in each trial, the individual fish scores, or something else? Be specific. How many tails does your paired test have?",2,2
"1835","These are raw data",2,2
"1836","Statistics",2,2
"1837","This part can wait for discussion",1,1
"1838","You only need this figure, you don’t necessarily need the other one. Figures should not have titles and you should not have average weigh of caterpillar as a y-axis, think about what you are actually measuring.",2,2
"1839","Try to use passive voice",1,1
"1840","This is a good figure and sums up the other figure nicely, so you only need to include this one.",2,2
"1841","p-value",2,2
"1842","I’m not sure why you got rid of your previous materials and methods section. This one doesn’t really explain to the reader what was done for your experiment.",2,1
"1843","Another potential reason could be error in isolating the chloroplasts from the leaves. Recall that you didn’t actually record the relative density of chloroplast this time. Going through that step to ensure your sample actually had a high density of chloroplast would be an effective way to ensuring that you had chloroplast in your treatment to begin with.",2,2
"1844","Where is your p-value?",2,2
"1845","Paired or unpaired? Tails?",2,2
"1846","Was that the case? Then do not speculate.",1,2
"1847","Title should VERY briefly state the main takeaway of your experiment",1,1
"1848","What was this distance?",2,2
"1849","Provide %change data after 30 min and refer to figure.",2,2
"1850","Your figure legend should tell me what you wwant me to get from looking at this figure.",2,2
"1851","What did you find? You don’t need to mention your methods in the title. Give the highlights!",2,1
"1852","Need to have error bars on graphs",2,2
"1853","Combine the mean and SD for each group. Report them together.",2,2
"1854","Error bars formatted incorrectly",2,2
"1855","I don’t believe this actually qualifies as primary literature. You can include it, but you need an additional citation from a study or journal article in your intro in order to meet the citation requirements for the revision.",2,1
"1856","???",2,2
"1857","Include a reagent table with your assay in the supplement and refer to it instead.",2,2
"1858","Careful of interpreting results in the results section, wait till discussion to say this",1,1
"1859","What is this value for?",2,2
"1860","This is unnecessary. You don’t include the table with the data used for the statistical analysis in the lab reportThe statistical analysis is not quite right. You included in both groups the weight of your four individuals for the eight days of the experiment. How can you analyze the growth in each group if you included the weights from every single day? To analyze how the animal is growing you need to see the change in weight between days. That’s the only way of knowing if an animal is growing. Look for the difference in weight between the final and the first day of experimentation.",2,2
"1861","Your tone was not scientific enough throughout the lab report.C",1,1
"1862","Why? You need to explain this in terms of relative availability of resources",1,1
"1863","Need more information in the figure captions",2,2
"1864","Once again get a little more specific",1,1
"1865","Future implication at a broader scale not reflected",1,1
"1866","Are these questions different or are you asking the same twice? Please, avoid repeating information.",1,1
"1867","revise",1,1
"1868","Include the name as well.",1,2
"1869","Problem with error bars. They look the sameReconsider the x-axis",2,2
"1870","Can you find a more natural way to begin your intro? You can just start talking about the frog, for example. We’ll figure out that this is what you’re using!",1,1
"1871","You should say this first thing in the paragraph; start your discussion by addressing whether or not your hypothesis was supported",1,1
"1872","Also citation",2,2
"1873","So remember you can just write the average +/- sd you don’t need to say “with a standard deviation of”",2,2
"1874","You don’t need this, it is raw data and show not be in the report",2,2
