"","text","subject_label","subject_predicted"
"1","Please report your means +/- SDs, but otherwise, good results section!",3,3
"2","Delete gridlines",3,3
"3","For statistical tests, you only need to state which test was used (in the methods) and your p-value (Results/discussion)",3,3
"4","Can you expand on this a bit? Make the definitions of plasticity and resource allocation really clear for a reader. Good job of integrating a relevant source to support your hypothesis.",2,4
"5","Reconsider the x-axis. Maybe using numbers for the days would be betterAre these averaged values? Where are the SD?",3,3
"6","You could specify the analyzed muscle",3,3
"7","Not a primary source or incorrectly formatted + missing details",3,3
"8","You need to explain the error bars and include statistics",3,3
"9","This is a methods section. It cannot contain hypothesis. Be careful not to add useless details. Examples of TOO much detail are “…I used a paint brush to place a red dot on each grasshopper…” or “...we graphed our data...”",3,2
"10","What do you mean?",3,3
"11","You also don’t need a figure with your statistical results, as you state them in the results section. Keep your one graph (but take away the title – that’s what figure captions are for), try and change the graph so all controls are the same color and all treatments are the same color, so have a more clear legend that breaks down which individuals are control and treatment)",3,3
"12","This would make sense if your hypothesis HAD been supported. What do you make of the fact that there was no significant difference, though? You get to it in the following sentences, but your discussion should make logical sense and not contradict itself. The source you cite looks like it should have some good information in it that will help you build your argument; you can even compare what you found to the results of that study.",4,4
"13","The table doesn’t exist in this report. There shouldn’t be a table anyway, include what would’ve been in your table into your methods section directly",3,3
"14","You don’t need to specify graphing",3,3
"15","I would try to include the trend you saw (did the frequency increase or decrease?)",3,3
"16","You didn’t measure UV here, you used sun vs. shade. Sunlight contains other wavelengths of light aside from UV.",3,4
"17","Precor is just the name of the pesticide. I would leave it as “Precor” rather than “Precor Hormone”",3,3
"18","These are two different cells, so the same action potential (AP) cannot be in both Those are 2 AP, so you are missing some steps in between.",3,3
"19","This is the p-value for the comparison of your results, so it is a result. That should not be in this section. In the methods you only need to mention the type of statistic test that was used and you can specify the p-value used for significance. That is all.",3,3
"20","Within the abstract, the concentration can be left out.",2,2
"21","Make it clear how much each caterpillar actually gets (don’t make your readers do the math themselves)",3,3
"22","In that case, you can omit it. Only include the background information more relevant to understand the experiment",2,2
"23","Insect development has a lot of components. What Specific development is referred here?",2,2
"24","This isn’t really relevant to understanding your experiment, you can take it out.",2,4
"25","With a force transducer",3,3
"26","This experiment cannot quantify this.",3,3
"27","Specify the statistic test for this p-value",3,3
"28","You also need to flesh out those primary resources, what were the studies they did? What did they find? How is it similar to your own?",4,4
"29","Make it clear that by “result”, you mean p-value.",3,3
"30","You should just have the last name of the first author",3,3
"31","What was the effect? Be specific.",3,2
"32","But you did not find a significant difference between reactions to real fish and models, so how can you make this argument?",4,4
"33","[Johnson: 2018]",3,3
"34","Here would be a great place to mention artificial selection",4,2
"35","How can I see this information in the graph? This graph does not show information about the diet, so this should not be included in the figure legend.",3,3
"36","Any research showing this might help to fill out your intro a bit more",4,2
"37","I’m still confused by this statement",2,3
"38","This should go in the results",2,3
"39","This is not actually the correct citation format. I understand that it was in the annotation exercise, but the format your resource guide (p42) asks for is [Author: Year].",3,3
"40","Specify in insects",2,3
"41","Very detailed title! You could possibly make it a bit more concise…",2,2
"42","This can be consolidate with the comment above. You would say that the results support the hypothesis, and then state the p-values.  You would then include a sentence about the biological reason why you got the results and why adding JH would have had this effect.",2,4
"43","This is methods so you don’t need it in figure caption, consult the core resource guide and primary literature to see how their figure captions look.",3,3
"44","Caterpillar",3,3
"45","Mention your p-value, and then add a concluding sentence",2,2
"46","2 sig figs is enough!",3,3
"47","How did you treat them (methods)?",3,2
"48","This was your prediction, then you should mention it like that. Instead I would mention the effect of caffeine in the relaxation process of the muscle and then state your prediction.",2,4
"49","They were not different groups. The same animals were control and experimental conditions. Write this according to that.",3,3
"50","Check your x-axis",3,3
"51","I think you copied down the same stats twice",3,3
"52","Title should VERY briefly state the main takeaway of your experiment",2,2
"53","provide molarity",3,3
"54","Stats?",3,3
"55","True, but why do we need to understand intraspecific aggression in the first place? What are its costs and benefits?",4,4
"56","Keep in mind that A23187 also targets IP3",3,2
"57","See p. 42 of the BioCore Resource Guide for the citation format we are using. (It is not the same as the one in the annotation exercise.)",3,3
"58","Another potential reason could be error in isolating the chloroplasts from the leaves. Recall that you didn’t actually record the relative density of chloroplast this time. Going through that step to ensure your sample actually had a high density of chloroplast would be an effective way to ensuring that you had chloroplast in your treatment to begin with.",3,4
"59","What statistical test did you run?",3,3
"60","This is not an explanation of the results",3,3
"61","[Johnson:2018], make sure to state this at the end of every sentence that you use information from it",3,2
"62","Have to have references in the discussion section. Compare to other studies, to support why your data did or didn’t match your predictions",1,4
"63","Specify that this was for stimulation",3,3
"64","I would just state that the IGR you used was Martin’s IGR, which mimics JH functions in the body",3,3
"65","I’d nix this and let the means speak for themselves.",3,3
"66","I would include a little bit more background on the Manduca life cycle here",2,2
"67","These are raw data.",3,3
"68","Why is this significant if the p-value = 0.44? That is greater than 0.05, the cut-off level for significance, so the difference between groups were by chance.",3,3
"69","Keep this thought going. Where would varying degrees of CO2 come from?",4,2
"70","What means?  Mean of weight? Length?",3,3
"71","The goal is not to prove the effectiveness, but to compare effect on control and treatment.",3,3
"72","This is good for an intro, but it is too general for the Abstract. This section is the summary of the paper, so only include very concise information, relevant for the experiment.",2,2
"73","This belongs in methods",2,2
"74","[Grunert: 2015]",3,3
"75","All your numbers should have units",3,3
"76","Don’t forget to label your axis here as well",3,3
"77","Roughly 70µL",3,3
"78","Compare your results to other studies",4,3
"79","This sentence does not make sense",2,2
"80","What about statistics? How did you calculate R:S",3,3
"81","You said that you expect similar results, but you didn’t explain their results. I would recommend you to actually mention what would you expect, instead of saying similar results.",4,4
"82","“like” is an informal term, consider “such as” instead. Use your best judgement to locate informal/colloquial terms in the rest of the report and revise.",2,2
"83","Hypotheses are never “incorrect” but rather, are or are not supported by your data",2,2
"84","Remember to put the title of the graph immediately after the figure number (even if it is also on the graph itself)",3,3
"85","Too many digits",3,3
"86","Also, add a concluding sentence",2,2
"87","So, higher concentration of saline  less photosynthesis than the lower concentration?",3,3
"88","You could mention this different. The data is showing a tendency, however you didn’t get conclusive statistic results to support the hypothesis.",3,3
"89","Commented above.What specific data (the values you put in) is not significant?  You said it had tetany every time, that should be significant so what ever data you put into the t-test wasn’t (tetany vs not tetany).  Let me know if you are confused.",3,3
"90","Need to show the data and give the p value for both dependent variables you discuss",3,3
"91","mM",3,3
"92","Revise this statement to make it clearer.",2,2
"93","How is this supporting your previous statement? That is not clear",4,2
"94","Ah, but it is unicellular! (Isn’t Physarum so cool?!)",4,3
"95","Avoid stating stat results in abstract. Alternatively, you can say that your herbicide did not significantly decrease photosynthesis which was supported by your t-test analysis.",2,2
"96","This is not a very scientific way of phrasing this",2,2
"97","Repetitive",2,2
"98","You can combine these into one sentence, 2.75 +/- 0.72g",3,2
"99","This is not a significant p value. Also just say that there was a significant difference between groups (t = , df = , p = )",1,3
"100","The maximum voltage? Are you sure?",3,3
"101","Not exactly, a p-value below 0.05 would indicate the means of the two groups are significantly different.",3,3
"102","Your citations should support your findings in that it should explain why your results were surprising/not surprising.",2,3
"103","You might want to move this earlier in the abstract (think about organizing your abstract like a condensed version of your paper).",2,2
"104","How? By repolarizing the membrane.",3,3
"105","This is not the title of a lab report. That is the title of the unit. The title should give information about the experiment that you did.",3,2
"106","This is awkward.",2,3
"107","Interspecific refers to reactions between animals of different species. You don’t need the sentence about quantification",3,2
"108","Try to get more specific about mL amounts, same for treatment and include dilution/concentration",3,3
"109","You background information on the subject needs to be more prevalent here. Talk about nerves and muscles more generally and the frog.",2,2
"110","This difference was not significant (t-Test, p-value = 0.183)",3,3
"111","This is a replicate. It cannot have a separate p-value.",3,3
"112","This can be alleviated to a degree with a larger sample size. As such, I think it would be worth mentioning a larger sample size as a possible improvement.",4,4
"113","I would try to show this as a bar graph with standard deviation error bars",3,3
"114","Revise this statement and focus on the part that you used Hill reaction assay, which was an important aspect from your methods section.",3,3
"115","many grammar mistakes/ tense errors/ and typosneed to reference more past literature and include citationsexpand errors/future research",2,2
"116","Procedural error could be one reason. Maybe the chloroplasts were not successfully isolated. Recall that you did not actually look through the microscope and calculated relative chloroplast density this time. It could be error at maintaining the temp during the experiments. Explore possible reasons!",4,4
"117","This abstract needs to be reformatted a little bit. Think two sentences for your intro, your hypothesis, one sentence for methods, two for results, and a short concluding sentence",2,2
"118","I didn’t catch this before, but we can never prove things in science.",2,2
"119","They were not different specimens, they were the same before and after injection. Focus better on what you predicted it will happen after the injection.",3,4
"120","Also, I believe this discussion needs to change a bit since you were inhibiting E20, not increasing it.",4,3
"121","Instead of thinking that three replicates were too small, think about the procedure of isolating the chloroplast. Maybe there weren’t enough chloroplast in the samples because they weren’t isolated properly. You mentioned about it in later sentences. Three replicates is a standard sample size so I wouldn’t say that it is too small.",4,4
"122","Be sure to proofread before submitting for small mistakes like these throughout your report",2,2
"123","This discussion is a little hard to follow, you need to connect these studies back to your own and explain why you think you did not see the expected result (in terms of biological and chemical reasons)",4,4
"124","Please no URLs",3,3
"125","Based on what you currently have, make sure to say whether your hypothesis was or wasn’t supported (I understand that it’s glaringly obvious that there was little difference in threshold voltage but I would still add in a p-value). Afterwards, you can discuss why the data may not properly reflect the role of potassium channel blockers and how it can be improved.",4,4
"126","Unnecessary detail that could have been included under the caption of reagent table instead, or, if decided to include in this section, could have been summarized better",3,3
"127","This table is not necessary",3,3
"128","Year?",3,3
"129","A brief (1-2 sentences) explanation for why the model organism was good to use in your experiment.",3,4
"130","Run on",2,3
"131","This should only be in your methods section. You can write that the weights will be measured but that’s it",3,3
"132","Need s.d.’s",3,3
"133","Indicate your critical value for p to determine significance",3,3
"134","You don’t need so much detail in the methods of your abstract. You only need to say that you grew plants in light and dark environments and measured their R:S",2,2
"135","Source?",3,3
"136","Include in the method section then delete this figure",3,3
"137","The corpus cardiacum is a neurohemal organ, so it doesn’t secrete hormones. The brain hormone, according to its name, is produced in the brain by neurosecretory cells.",3,3
"138","This abstract needs a little work. Think two sentences of intro, hypothesis, one sentence for methods, two for results, and one short concluding sentence.",2,2
"139","Non-significant.",2,2
"140","you didn’t mention anything about your inhibitor neomycin. You need to provide this info justified by primary lit",4,2
"141","Make sure to include what statistical test you used.",3,3
"142","The standard deviation bars for this graph was not formatted properly and seems to have been made by excel’s default standard deviation error bars (They don’t work). If you need help with putting standard deviation bars, you can either email me to meet or take a look at the resource guide for instructions.",3,3
"143","You say the experiment is important for understanding links between behavior and fitness, yet the example you give here doesn’t say anything about fitness. Can you be more specific? Are you saying that bettas in murky water might be more fit than their clear water counterparts? Or that the decreased aggression might lead to higher fitness? Please expand.",4,4
"144","This is a little bit informal. Try something like, “We began by planting ## buckwheat seeds, which grew in the greenhouse for 14 days.” Then you can include the supporting details.",2,2
"145","Explain what the error bars represent in your figure caption/legend, not here.",3,3
"146","Make it clear that your leg was suspended from the force transducer (this is how you measured twitches)",3,3
"147","you don’t have to mention it",2,3
"148","Yes! This is what should go in the methods.",2,3
"149","Making them weigh less compared to what?",3,3
"150","Colloquial",2,2
"151","Which are specifically called…?",3,3
"152","same here do not instruct just tell what you did (Methods text)",3,3
"153","Do not reference figures nor tables in the Abstract.",2,3
"154","Does the venom block potassium channels? I’m confused about how this is related?",4,4
"155","I think you are talking about twitch threshold? I would call it such throughout your paper so it makes more sense",3,2
"156","Don’t state this until the discussion",1,2
"157","Make sure to also include concentration",3,3
"158","No need for figure title",3,3
"159","Start broad",2,2
"160","You only need to report the p-value for the ANOVA, and you only need to report it once. Say something like, “There was a significant difference in red mane response time among the three groups (p=), and the Tukey Kramer test shows that X and Y groups and Y and Z groups were significantly different from each other.",3,3
"161","Colloquial language",2,2
"162","Nice using primary literature but make sure it is obvious what the connection between it and your experiment is",4,4
"163","No URLs for peer reviewed articles.",3,3
"164","The p-value is the probability that the given results are due to chance",3,3
"165","Wouldn’t the threshold then be higher? Which would support your hypothesis?",4,3
"166","The mimic or what?",3,3
"167","Are these error bars fitted to each group?",3,3
"168","3) don’t state if your hypothesis is supported or rejected in this section, that only goes in your discussion",1,2
"169","Third, reiterate your statistical results in the figure caption.",3,3
"170","At what temp?",3,3
"171","What groups were compared?",3,3
"172","Delete gridlines",3,3
"173","…because you said this.",2,2
"174","“Herbicide treatment” or when treated with herbicide. Go through results and discussion sections to make necessary editing in order to convey the message in a much clearer way.",2,2
"175","Citation format is [last name : year]",3,3
"176","Use the Author",3,3
"177","It is recommended to write in an impersonal format. Avoid using the first person of the singular or plural.",2,2
"178","Okay great, restate your findings to orient the reader and make the rest of your discussion flow much better. You don’t need to include the next few sentences (crossed out here), as you already said those things in the methods. You spend a lot of time discussing the Shulman study, and it’s a good one to support your findings, but do a bit more interpretation of your own data. Why might the fish be using the shelter and avoiding aggressive conflict, what benefits does that bring to the fish? Think about it in terms of fitness and evolution.",4,4
"179","Better figures",3,3
"180","Lower case p",2,2
"181","Avoid this recipe style of writing methods section because that’s not how it is used in a scientific literature. Check primary literature on similar experiments to see how they wrote their methods section and revise.",2,2
"182","How did you average the coloration? That was not a quantitative variable, so you cannot average it.",3,3
"183","Write the scientific question more clearly. Right now it is confusing.",2,2
"184","Use the means (average) for each group to graph your data. You were looking for the effect of IGR between 2 groups and not between replicates. As you can see in Fig. 1; the groups next to each other are not experimentally paired.",3,3
"185","Report the mean ± SD. You should always report those values together.",3,3
"186","Statistically? Visually?",3,3
"187","Make sure to include outside sources in the introduction (Basic Criteria).",1,1
"188","Mention how many frogs are in each group and just have your y-axis say “Twitch Threshold (Volts)”",3,3
"189","State sample size for each group",3,3
"190","Add error bars! And be more specific with your legend—0 mM of what?",3,3
"191","Citation format",3,3
"192","Figure 1",2,3
"193","This was established in the methods and doesn’t need to be stated here.",3,2
"194","Your intro needs a lot more work. Include regular nerve/muscle function to lead into why you expect your blocker to work.",2,2
"195","Reference the figures in this sectionDescribe the trends and then support those trends with the statistical analysis",3,3
"196","State the species and muscle you are working with",2,2
"197","Well, this includes blue, right? I’m a little confused about your rationale with DCPIP because we’re talking about the chloroplasts’ abilities to absorb light. I would add more bio background, introduce DCPIP and why we used it",4,4
"198","This is almost raw data and a table is not the best way to represent it. You should include at least one graph in the report, and I would suggest using it to replace this table.",3,3
"199","Focus more on discussing biological mechanisms, and less about possible sources of error",4,4
"200","This figure could be improved by either color-coding individual legs or control vs. experimental groups to give some basis for comparison.",3,3
"201","informal",2,2
"202","Try to make this more succinct.",2,2
"203","Why else would we want to use/study Physarum in the lab?",3,3
"204","Put in the amount of legs you analyzed, so including the extra data you recieved",3,3
"205","You error bars on your graph are not correctly done, so this will have to be changed to include the correct values. It is fine to talk about them in your results though. See comments on your figure for how to correct them",3,3
"206","avoid using question mark statments",2,2
"207","I don’t get this sentence or the previous one, so you only had two replicates? Clarify these or remove.",3,2
"208","Since the stats weren’t significant you have to conclude that there was no difference in the mass.",3,3
"209","You should mention the figures in this section",3,3
"210","Did you manipulate the threshold stimulus?",3,3
"211","For the same reason we avoid “prove” the word “correct” should also be avoided. You can leave it a bit more vague as “Our hypothesis was tested by….”",2,2
"212","Check the x-axis, it is not right. You can be more precise with the y-axis. What is the variable that you measured for this graph? The whiskers look very similar. Were the SD similar? If not, there is a problem",3,3
"213","In what conditions",3,3
"214","Wrong tense",2,2
"215","Do not put a title in the figure.",3,3
"216","How did you decide sig values?",3,3
"217","Muscle response? Be more precise with the dependent variable",3,3
"218","should have focused on the chloroplast isolating procedure and how it could have been improved.",3,3
"219","Were treated as a control would be a better way to put it",2,3
"220","Include statistics",3,3
"221","Unnecessary",2,2
"222","Colloquial language",2,2
"223","You should include information about the obtained results.",3,3
"224","What statistical test did you run?",3,3
"225","You should mention the direct observation. What was the obtained result. Just saying that they were statistically significant is not enough.",3,3
"226","Why no figure legends? You showed me what you attempted to include, so they should have legends.",3,3
"227","Why? What is affected mechanistically?",4,3
"228","move to discussion",2,2
"229","Avoid using the same words than before.",2,2
"230","Tubocurarine is a nicotinic acetylcholine receptor blocker. Because we know that acetylcholine must travel across the synapse and bind receptors, if these receptors are blocked, we expect the signal to not continue from nerve to nerve or nerve to muscle. This is the reason we would expect it a decreased muscle contraction.",4,4
"231","This is not very relevant for the experiment. Nonetheless, it’s a good idea to mention the advantages of the studied animal, but maybe this has more sense after you mention the goal of the experiment.",3,4
"232","Try to be more concise and clear in this section. Could you say the same info in 3-4 sentences? Be sure to refer to your figures",2,2
"233","at",2,3
"234","informal",2,2
"235","Alpha value?",3,3
"236","Two sample t-test",3,3
"237","I would get rid of this part, as it doesn’t sound super scientific",2,2
"238","revise",2,2
"239","Show results. At least p-values",3,3
"240","This needs to be much longerConsider breaking it up into several major sectionsWhat did you find and what does it mean",3,3
"241","Informal. Revise to make it formal. Locate other informal/colloquial terms and revise.",2,2
"242","This comes later when discussing your results",2,2
"243","How much of this did you inject?",3,3
"244","Focus less on habituation, and more on biological mechanisms…like maybe aggression is based on size moreso than color of opponents?",4,4
"245","Finally, you need to explain how your citations relate more specifically to your findings/study species.B",4,4
"246","Give me full names first, then acronyms.",2,2
"247","What is this, another caterpillar/moth or holometabolous insect, get a little more specific in the future",4,2
"248","p-value to back this up?",3,3
"249","Also, recall that you didn’t quantify the presence of chloroplasts in your samples. You could have done it using a hemocytometer.",3,4
"250","Clean this up, you can use numbers also report your averages and standard devs for each group.",3,3
"251","Increased how? R:S is a proxy for resource allocation, but the words are not synonymous.",2,2
"252","You don’t need to formally write out the independent and dependent variables. Just state what the different groups were fed",3,3
