"","text","subject_label","subject_predicted"
"539","All information that is not common knowledge needs to be cited.",2,2
"540","P-value",2,2
"541","Which ones? (Stats question in abstact)",1,2
"542","Much better job introducing plant allocation, although you need to better introduce your specific experimental treatment in  order for your hypothesis to make sense",1,1
"543","iWorx",2,2
"544","Report results of your t-test as shown in the resource guide.Report means and standard deviations as mean ± sd. Two sig figs is enough.",2,2
"545","needs citation",2,2
"546","You need to use primary literature in the intro and discussion (one of the basic criteria). This is an automatic failing grade.",1,1
"547","Your introduction needs more information on why Manduca are helpful to study hormone regulation in, and what JH normally does in their body.",1,1
"548","This isn’t necessary as you can assume the readers will know how to use a balance.",2,1
"549","Focus on the results obtained and explain the trends.",1,1
"550","You should rename your legend to show “Lidocaine” and “Control” instead of “series 1” etc. as in the other two figures. Also, what are the units for amplitude (volts, I think) for all three figures?",2,2
"551","Lab manual citation is [Johnson : 2018]",2,2
"552","Refer to the figure number.",2,2
"553","This graph is repeated",2,2
"554","In plants at least…",1,2
"555","Reconsider the y-axis",2,2
"556","Instead of saying that, just describe the observation.",1,2
"557","This should go in the results section",1,2
"558","You also need to include a citation in your discussion.",1,2
"559","This is not a figure legend. You need to explain the figure information here",2,2
"560","Statistical test?",2,2
"561","This is known the moment you say the p-value.  Use this sentence to sum up your discussion instead.",2,1
"562","For your list of Literature Cited, use the one format. Do web links should be used for peer reviewed articles.Include the lab manual",2,2
"563","Hypothesize?",1,1
"564","Be precise. Do not base your exlanations in feelings",1,2
"565","I think this is your hypothesis. In that case, you cannot cite the hypothesis because that is the biological question of the present work, is not an observation from a previous study",1,1
"566","What is the connection between development and weight gain, if there is one?",1,1
"567","Which one?",2,2
"568","Citation format",2,2
"569","Try looking for the active ingredient in Precor. It uses a JH analogue rather than JH itself.",2,2
"570","And that.",1,2
"571","Talk more about what this study did and found",1,1
"572","How is this related to your experiment? Does it explain your results? You need to explain how you can interpret your results based on their previous findings.",1,1
"573","JH is present up until the pupa stage, so this isn’t necessarily true",2,1
"574","I would mention the chemical name as well",2,2
"575","This is summed up well with your bar graph, so you don’t need to include this",2,2
"576","Where is your hypothesis? (Basic Criteria)",1,1
"577","How? Especially since you had contamination, you need to describe how you sterilized things.",2,2
"578","So you should’ve injected 0.1 ml of 1mM tubocurarine",2,2
"579","What are the values between parenthesis the SD for of the variables for the control and experimental groups or both variables for one group? That is not clear just reading the text. Nonetheless, I would report the mean and SD together and then interpret those results",2,2
"580","Combine this figures and create just figure caption",2,2
"581","Not sure this is the best verb. ‘Stimulated’ perhaps?",1,1
"582","So did you not run a statistical test? You should’ve done a two sample t-test to determine if the difference in weights between your two groups was significant",2,2
"583","While the absorbance values are inversely proportional to photosynthesis activity, percent change is directly proportional. Throughout the discussion either pick absorbance value or percent change and refer to p-value.",2,2
"584","This abstract needs a little bit more in it. Think two sentences for intro, your hypothesis, one sentence for methods, two for results, and a short conclusion",1,1
"585","Need to explain what the behaviors are",2,1
"586","You could actually include dilution calc info, 1x1cm square info, how 2% water agar medium was prepared—all these in your reagent table.",2,2
"587","You need a little more info on what ecdysterone specifically does, and how it related to weight of the caterpillars",1,1
"588","I don’t think you uploaded this figure?",2,2
"589","So this is the t-stat, it is more important to have a p-value in here",2,2
"590","In what?Above you use ‘photosynthetic rates’  and below photosynthetic activity I would pick a term",1,2
"591","Report the SD with the mean value",2,2
"592","You can embed this into your experimental layout earlier in the methods—might flow better.",1,1
"593","No need to list materials. You can just mention them as you use them in the procedure.",2,2
"594","Did you measure weight?",2,2
"595","I still think you should do a Tukey-Kramer.  Because actually? The error bar looks significant to me, so…",2,2
"596","I still don’t see that biological reasoning for pH affecting the light-dep. Reactions of photosynthesis.",1,1
"597","Typo?",1,1
"598","Ok, the way you have this organized is pretty confusing, because you’re going back and forth between two values for four legs. Talk about the threshold for all four legs first, then talk about contraction amplitude",2,2
"599","Did you average distance migrated or calculate a rate and average that? Put that here!",2,2
"600","But you predicted a decrease in the threshold.",2,1
"601","This was not possible because the Achilles tendon was tied. Be careful with the cause-effect relations that you do.",1,1
"602","I would recommend a two-tailed t test (or a two-sample t-test)",2,2
"603","Its hard to compare the effect of treatment when each figure is a separate treatment. You should combine broadside and facing into a total aggressive score and then compare the mean and standard deviations of the total behavior by treatment. Your error bars are also formatted incorrectly in the second figure. Come see me if you need help with excel.",2,2
"604","Why do you think your results may have been different from what you had expected and what would you recommend changing in future experiments?",1,1
"605","there is not a multiple variable t-test",2,2
"606","Don’t put quotes in your lab report",1,1
"607","Your hypothesis is either totally supported or not, each leg does not support or rejected your hypothesis",2,1
"608","But you weren’t trying to test for pupation?",2,2
"609","This sounds backwards?",1,1
"610","A brief (1-2 sentences) explanation for why the model organism was good to use in your experiment.",2,1
"611","You should not have raw data in your lab report",2,2
"612","Dont have this as its own sentence but rather as if its an in-text citation at the end of the last sentence in the figure caption.",1,2
"613","Reference your figures in here to better explain what is going on.",2,2
"614","Avoid repeating words",1,1
"615","Need a little bit more background info about why this may be the case",1,1
"616","Try to be a little more specific",1,1
"617","You need a little bit more on why you think you would get that result, what effect does JH have on weight, what is the correlation there? Explain that throughout the introduction",1,1
"618","They did still contract though, so what exactly is going on?",1,2
"619","This is a good graph.  Could increase the size of the legend some for ease in reading.",2,2
"620","citation",2,2
"621","as",1,2
"622","pupa",2,2
"623","The overall average weight gain/loss with the standard deviation would be a bit more useful than just the standard deviation",2,2
"624","Anything general enough to be used in the abstract doesn’t typically need citation.",1,1
"625","Also, maybe it did grow toward food at the beginning but changed direction later.. the traces could actually be revealed against a light source..",2,1
"626","I think this was a typo. It’s “50 mL centrifuge tubes”",2,2
"627","Combine these with the previous results",2,2
"628","Do not interpret data in the methods",1,2
"629","Is this part of the figure? The statistical comparison is not visualized in the figure",2,2
"630","Revise",1,1
"631","In your intro you need to talk more about the biological things that happen what would be affected by caffeine",1,1
"632","Section too short. Analysis should be done regardless on experimental errors. Mistakes in data collection or monitoring had resulted in cool unintended discoveries.",1,1
"633","Colloquial language",1,1
"634","Error bars represent?",2,2
"635","Refer people to your figures in the results section.",2,2
"636","Then why you have Figure 1?",2,2
"637","You have 200 words for an abstract, use them. Look through primary literature and the core resource guide for information to add into an abstract",1,1
"638","You don’t need to justify what stat test you are doing",2,2
"639","What did you mean by similar? Remember that the proportions of these hormones are different along the animal’s life cycle",2,1
"640","Citation formatting",2,2
"641","You shouldn’t reference another experiment if you are talking about your own here",1,2
"642","Another potential reason could be error in isolating the chloroplasts from the leaves. Recall that you didn’t actually record the relative density of chloroplast this time. Going through that step to ensure your sample actually had a high density of chloroplast would be an effective way to ensuring that you had chloroplast in your treatment to begin with.",2,2
"643","You just need to write a lot more than you did. Refer to the Biocore Resource Guide to see what is expected of each section and/or come talk to me about how you can improve.",1,1
"644","If none of them died you don’t need to state that",2,2
"645","Citation formatting",2,2
"646","This is not needed",1,2
"647","Stats?!",2,2
"648","did you use averages from each pot?",2,2
"649","Technically this is primary literature but you need to talk about what they did and what this study found and how it relates to your paper",2,1
"650","Make sure I can see the negative end of the standard error bars",2,2
"651","This figure is not necessary. Just include figures with your results.",2,2
"652","This discussion is a little hard to follow, you need to connect these studies back to your own and explain why you think you did not see the expected result (in terms of biological and chemical reasons)",1,1
"653","Find a different way to phrase this so it is more concise",1,1
"654","Look out for plagiarism both in your intro and in your methods. Find other resources and/or make them into your own words to avoid this happening again. Breathe! We’ll fix this.",2,1
"655","and that happens all the time, that is science! You don’t need to mention this",2,1
"656","You could include the p-values you stated at the top, here instead. Same for the statements about the avg. lengths.",2,2
"657","Very detailed title! You could possibly make it a bit more concise…",1,1
"658","Those channels move Na+ and K+",2,1
"659","typo",1,1
"660","Just say marginal",1,2
"661","Could you check this again? Your table has a different p-value",2,2
"662","Why are you interested in this?",2,2
"663","This is not true. Do not assume that you did the experiment wrong. There could be biological explanations, alternative hypothesis, etc. You cannot attribute the results to experimental errors.",1,1
"664","PTTH?",2,2
"665","You need another source",2,2
"666","You are missing important information in this sectionSome background informationBriefly describe the methodologyThe hypothesis should be included also",1,1
"667","You already said this, no need to say it again. Just jump right into the interpretation part.",1,1
"668","Also, I’d connect the dots—it might be easier to see a clear relationship here.",1,1
"669","I would include the number of pulses as well as the width used as well (the duration of the stimulus)",2,2
"670","Informal",1,1
"671","State your p-value somewhere and results briefly if you have the word count to do so",1,1
"672","Are you able to prove this?",1,1
"673","In-text citation format [Johnson: 2016]",2,2
"674","Avoid stating any stat value in the abstract. You can rather say that the significant statistical difference was confirmed by one-way ANOVA test.",1,2
"675","And what was the control’s diet",2,2
"676","This disagrees with the first sentence of your results (which is in the wrong section).",1,1
"677","Need to include more in these figure captions. Need to include what the respective statistics values are as well as what the legend is in words.",2,2
"678","Again, think of a better flaw",1,1
"679","What statistical test was used? And your alpha value was not 0.005. Think about it and let me know if you still don’t know.",2,2
"680","How does this relate to your study? You need to connect the dots for your reader",1,1
"681","Why? What support do you have for this?",1,2
"682","Perhaps a little too broad",1,1
"683","Did you sterilize anything?",2,2
"684","Good abstract. Can you add a (half) sentence explaining why you made the hypothesis you did? (Maybe replace your first sentence with something about how calcium in important for muscle contraction)",1,1
"685","DO NOT DISCUSS THE HYPOTHESIS IN THE RESULTS!(We’ve repeatedly gone over this in class and I commented on it in your last lab report. Please come see me if you have questions.)",1,1
"686","This is unclear and doesn’t match your methods.",2,1
"687","Not necessary (only your main hypothesis is needed in the intro)… also, “biological statistical hypothesis” is not a thing",2,2
"688","The goal is to “understand patterns/outcomes” not “prove”.",1,1
"689","This sounds more like a prediction, but it’s phrased as a result. Revise please!",1,1
"690","What evidence does this provide you for your own experiment, why is this study relevant. Make that clear because the connection seems confusing.",1,1
"691","Right, so can you take this a little further? What does it say about the evolution of these fish, and artificial selection in particular? It’s important to make this connection.",1,1
"692","Start more broadly",1,1
"693","What information is required in the Abstract? BioCore Guide, page 41 You are missing information from some sections of your lab report",1,1
"694","Where is this source referenced in the text?",2,2
"695","These belong in methods",1,1
"696","Write this section in past tense. Also use the actual symbols instead of writing out words like “degrees Celsius” or “microliters”",1,1
"697","This table shows data that is better provided as a sentence in your results section.",2,2
"698","For statistical tests, you only need to state which test was used (in the methods) and your p-value (Results/discussion)",2,2
"699","This is interpretation, which goes in the discussion, not in the results.",1,1
"700","No need to discuss sources of error unless you have evidence that it actually affected your results",1,1
"701","Do you think a picture would be helpful to visualize this results?",2,1
"702","This is unclear",1,1
"703","You need to describe here the trends of your graph. It is not enough just to mention that the statistic was not significant. Remember, statistics is just a tool, not the most important thing in your results.",2,2
"704","Make sure you include the alpha value (0.05)",2,2
"705","Wait. I thought your hypothesis was glucose &gt; glycine?",1,1
"706","Mention how you prepared 20x dilutions since you didn’t provide a reagent table as a supplement",2,2
"707","A brief (1-2 sentences) explanation for why the model organism was good to use in your experiment.",2,1
"708","You need to expand on this more. Why would increased weight and length be connected with increased JH?  It has to do with the commitment pulse but you need to say more about that.",1,1
"709","Hypothesize would be a better term",1,1
"710","Cut -off level for significance.",2,2
"711","Are these averaged values?Where is the SD?",2,2
"712","storage conditions?",2,2
"713","No websites required for peer reviewed articles. Also See link below for necessary improvement",2,2
"714","Don’t put the chemical concentration in your intro, just have it in the methods",2,1
"715","You injected into the muscle, so this is not really true. You did stimulate the nerve though",2,2
"716","This is too brief. You need basic background, hypothesis, methods, and results/discussion in your abstract.",1,1
"717","Abstract need improvement. See link at the end for guidance.",1,1
"718","Avoid starting sentences with “because”",1,1
"719","It’s good that you’ve now included primary literature, but avoid so many direct quotations. Paraphrase what the author said",1,1
"720","Does this author have a first initial? In the text you cite it as 2009, and here the year is 2010. Double check your work.",2,2
"721","What is better behavior?In general, the writing quality of this introduction needs to be improved. Your sentence structure is poor in some places, and the language is informal (e.g., “This is the fish at max aggression”).What about the fact that the native habitat of betta fish is murky (what you call opaque) water? How do you think that plays into the biology of these aggressive interactions? Why is it interesting or important to test on these aquarium fish?",1,1
"722","You can combine these two sentences into one by just cutting out what I’ve highlighted",1,2
"723","Also, add a concluding sentence",1,1
"724","Problem with error bars. They look the same in both treatments",2,2
"725","Why?",1,2
"726","What was the significance of your study and what happened",1,1
"727","Make sure you tie this back to aggression. What did you learn from this study?",1,1
"728","Your next sentence contains this information so you don’t need to state this",1,1
"729","What about making sure that the chloroplasts are healthy?",2,2
"730","supported",1,1
"731","Year?",2,2
"732","You had all fourth instar larva",2,2
"733","Give some indication of the results here",1,1
"734","Revise to make formal",1,1
"735","You don’t need to state this, put the intext citation at the end and that will suffice",2,2
"736","This sentence is unnecessary",1,1
"737","can you be more precise. Amplitude of what",2,2
"738","+/-? Report means +/- SDs before your stats.",2,2
"739","Is this the only function of Ca++ in the presynaptic terminal? Is Ca++ necessary for exocytosis?",2,1
"740","I don’t see how this information relates to decreased aggression in turbid waters.",1,1
"741","State “We predict that…” and then state your hypothesis",1,1
"742","Still need to have hypothesis in the abstract",1,1
"743","Can you be more precise about this? Specify each of those values to the stimuli parameters that you used.",2,2
"744","word choice",1,1
"745","State your statistical test but you do not report the results of it in this section.",2,2
"746","Quickly relate this back to a bigger picture. Why is it important to know how kale responds to differences in temperature?",1,1
"747","Supported, not proved",1,1
"748","Check the citation format",2,2
"749","Need more in the figure captions.",2,2
"750","Grammar",1,1
"751","This goes in methods section. Indicate both your independent and dependent variables in Methods.",1,2
"752","revise",1,1
"753","Should mention that you used Hill reaction to quantify photosynthesis",2,2
"754","Not significantly different; remember, a t-test is a comparison",2,2
"755","Both models were? Can you describe the models in more detail?",1,2
"756","Statistically larger or not?",2,2
"757","The table should be included as a few sentences in your results, rather than a table.",2,2
"758","Lower case p",1,2
"759","Just specify the statistical test used",2,2
"760","Use the averages of these data to make your graph.",2,2
"761","You can combine figures 1-3 in just one figure. That will concentrate your results better. What is the response in your y-axis? I yhink you meant Amplitude of contraction (V)",2,2
"762","Save this for the discussion.",1,1
"763","You use a lot of words in these sentences, but you’re not conveying a lot of information. Make them more specific and use examples to get your points across. This also allows you to bring in more primary literature sources.",1,1
"764","I would try to include the number of pulses and the width of each pulse (how long each pulse lasted).",2,2
"765","Just say that there was significant difference between the groups (t = , df = , P = )",2,2
"766","Is this a strong ending? Remember we want to bring it out to the big picture, and connect back to the introduction. Rework the structure of the discussion to leave the reader with a strong impression of why your work is important.",1,1
"767","Delete this. Raw data should be in lab notebooks, but not lab reports",2,2
"768","Label and figure caption# does not match",2,2
"769","Ringers",2,2
"770","This is not really scientifically written, so I would excluded",1,1
"771","Can you say more about this? What types of shelters are found in the natural environment?In general, your intro needs to be fleshed out a bit more. The first sentence, for example, is pretty broad but doesn’t tell me much about biology or why we study behavior. Think about the links between evolution, behavior, and fitness, and then incorporate this idea of taking shelter into those concepts.",1,1
"772","Getting results that do not support your hypothesis does not mean an error occurred in your experiment",1,1
"773","What did you mean with this? Did you increase voltage of stimulation form 0 to 10 V in steps of 1V?",2,2
"774","Missing the year",2,2
"775","Is IGR the same than ecdysone? Just use the biological term.",2,1
"776","percent",2,2
"777","Talk more about what that study did/found and how it relates to what you will test or find an additional study to relate to yours",1,1
"778","Remember, save any reasoning for he discussion!",1,1
"779","You can just state that because your p-value is very high, you reject your hypothesis. You don’t need to talk about the null",1,1
"780","Re write the hypothesis without saying based on the knowledge.",1,1
"781","For…? You might want to say something like “We chose this species to test the role of Ach in muscle contraction because the…”",2,1
"782","Highlight of this segment should have been reflected in the Abstract.",1,1
"783","This sentence is confusing",1,1
"784","What exactly do you mean by this?",1,2
"785","Where’s the t-test for the weight ratio?",2,2
"786","How do you know this? This should be cited",2,2
"787","Compare your explanation to results and interpretations of previously published studies and cite them.If appropriate, describe the alternative explanations of your data. If there is another possible explanation for your data, what future experiments are needed to determine the best explanation?",1,1
"788","No numbers. Remember this is a paragraph, not a recipe.",2,1
"789","Explain the number of individuals in each group. You can mention in the first sentence that they had similar size. Is not necessary to say that 2 of them were 4 cm and the other 2 4.5 cm.",2,1
"790","You don’t need to repeat all this again. You can just say that the same stimulation procedure was applied after injection to determine the new threshold.",2,2
"791","Make a graph with 2 bars. Mean change in weight for control vs treatment.",2,2
"792","What muscle?",2,2
"793","This is true, but what about your observed results? There was still a bit of a difference, albeit an insignificant. Do you still think your hypothesis was valid? How can you justify it or explain your results using biology?",1,1
"794","I wouldn’t list this as an error but a possible explanation for why your experiment may have been different from past experiments.",1,1
"795","Any suggestions about its effect on hormones ???",1,1
"796","I see no support for this whatsoever.",1,2
"797","should indicate that %change formula was used to convert the absorbance data (raw data)",2,2
"798","This is considered raw data and should not be included.",2,2
"799","They should be different for the different groups, not both .7114",2,2
"800","Check the citation formatting in the BioCore Guide pages  48-49.",2,2
"801","If not important, why begin your intro with a description of it?",1,1
"802","informal",1,1
"803","Which hormones? In what organism?",2,2
"804","Confusing. Revise.",1,1
"805","Once again why will this happen? How? What did Kingsolver do in their experiment?",1,1
"806","The definition of control and treatment group is better suited in the Methods. You could just mention a difference in the growth of animals under the influence of AzaMax.",1,2
"807","You need to make it clear how this related to your study and what it did, because it isn’t apparent how it is related",1,1
"808","Improper citation format. Also the lab manual is not primary literature",2,2
"809","So…what is DCPIP and why are we using it?",2,2
"810","Have you found a study that grew plants in the total dark? Could you use that to support this part of your discussion?",1,1
"811","This is a little bit informal. Try something like, “We began by planting ## buckwheat seeds, which grew in the greenhouse for 14 days.” Then you can include the supporting details.",1,1
"812","Greater overall plant growth does not equal greater R:S ratios… what do you really mean here? Or, do you have the data to support your assertion of greater overall plant growth?",1,1
"813","Missing statistical analysis",2,2
"814","The label itself isn’t as important as you can easily label them something else and get the same results. (Doesn’t affect reproducibility).",2,1
